{
  "schema_version": 1,
  "generated_at": "2026-07-24T15:58:37Z",
  "default_registry": "self",
  "sources": [
    {
      "name": "self",
      "kind": "git",
      "priority": 100,
      "trust_level": "private",
      "root": ".",
      "status": "ready"
    }
  ],
  "resolution_policy": {
    "private_registry_first": true,
    "external_requires_confirmation": true,
    "auto_install_mutable_sources": false
  },
  "skills": [
    {
      "name": "consume-infinitas-skill",
      "kind": "skill",
      "qualified_name": "lvxiaoer/consume-infinitas-skill",
      "publisher": "lvxiaoer",
      "summary": "Guide agents through search, recommendation, inspection, pull, install, and upgrade flows for released infinitas-skill artifacts.",
      "source_registry": "self",
      "source_priority": 100,
      "match_names": [
        "consume-infinitas-skill",
        "lvxiaoer/consume-infinitas-skill"
      ],
      "default_install_version": "0.1.1",
      "latest_version": "0.1.1",
      "available_versions": [
        "0.1.1",
        "0.1.0"
      ],
      "versions": {
        "0.1.1": {
          "manifest_path": "catalog/distributions/lvxiaoer/consume-infinitas-skill/0.1.1/manifest.json",
          "distribution_manifest_path": "catalog/distributions/lvxiaoer/consume-infinitas-skill/0.1.1/manifest.json",
          "bundle_path": "catalog/distributions/lvxiaoer/consume-infinitas-skill/0.1.1/skill.tar.gz",
          "bundle_sha256": "de61b36944f11503b8c0491eb620e63f116c027e2b1c22bc6b70853e56b63a52",
          "attestation_path": "catalog/provenance/consume-infinitas-skill-0.1.1.json",
          "attestation_signature_path": "catalog/provenance/consume-infinitas-skill-0.1.1.json.ssig",
          "published_at": "2026-07-21T13:21:02Z",
          "stability": "stable",
          "installable": true,
          "attestation_formats": [
            "ssh"
          ],
          "trust_state": "verified",
          "resolution": {
            "preferred_source": "distribution-manifest",
            "fallback_allowed": false
          }
        },
        "0.1.0": {
          "manifest_path": "catalog/distributions/lvxiaoer/consume-infinitas-skill/0.1.0/manifest.json",
          "distribution_manifest_path": "catalog/distributions/lvxiaoer/consume-infinitas-skill/0.1.0/manifest.json",
          "bundle_path": "catalog/distributions/lvxiaoer/consume-infinitas-skill/0.1.0/skill.tar.gz",
          "bundle_sha256": "70bf1b3f3eac804e010687267d6429edb9b9e1cf78c52353aec7533680e933ee",
          "attestation_path": "catalog/provenance/consume-infinitas-skill-0.1.0.json",
          "attestation_signature_path": "catalog/provenance/consume-infinitas-skill-0.1.0.json.ssig",
          "published_at": "2026-03-16T03:51:11Z",
          "stability": "stable",
          "installable": true,
          "attestation_formats": [
            "ssh"
          ],
          "trust_state": "verified",
          "resolution": {
            "preferred_source": "distribution-manifest",
            "fallback_allowed": false
          }
        }
      },
      "runtime": {
        "platform": "openclaw",
        "source_mode": "openclaw-native",
        "workspace_scope": "workspace",
        "workspace_targets": [
          "skills",
          ".agents/skills",
          "~/.agents/skills",
          "~/.openclaw/skills"
        ],
        "skill_precedence": [
          "skills",
          ".agents/skills",
          "~/.agents/skills",
          "~/.openclaw/skills",
          "bundled",
          "extra"
        ],
        "install_targets": {
          "workspace": [
            "skills",
            ".agents/skills"
          ],
          "shared": [
            "~/.agents/skills",
            "~/.openclaw/skills"
          ]
        },
        "requires": {
          "tools": [
            "read",
            "exec"
          ],
          "bins": [
            "git"
          ],
          "env": [],
          "config": []
        },
        "requires_tokens": [
          "tools:read",
          "tools:exec",
          "bins:git"
        ],
        "requires_detail": {
          "tools": [
            "read",
            "exec"
          ],
          "bins": [
            "git"
          ],
          "env": [],
          "config": []
        },
        "plugin_capabilities": {},
        "background_tasks": {
          "required": false
        },
        "subagents": {
          "required": false
        },
        "readiness": {
          "ready": true,
          "supports_background_tasks": true,
          "supports_plugins": true,
          "supports_subagents": true,
          "status": "ready"
        }
      },
      "runtime_readiness": "ready",
      "workspace_targets": [
        "skills",
        ".agents/skills"
      ],
      "agent_compatible": [
        "openclaw",
        "claude",
        "claude-code",
        "codex"
      ],
      "install_requires_confirmation": false,
      "trust_level": "private",
      "trust_state": "verified",
      "tags": [
        "discovery",
        "install",
        "upgrade",
        "openclaw"
      ],
      "maturity": "stable",
      "quality_score": 89,
      "last_verified_at": "2026-07-21T14:10:22Z",
      "capabilities": [
        "search",
        "recommend",
        "inspect",
        "immutable-install",
        "upgrade-planning"
      ],
      "verified_support": {
        "claude": {
          "state": "adapted",
          "checked_at": "2026-07-21T14:10:22Z",
          "checker": "infinitas install by-name --target-agent claude --mode auto",
          "evidence_path": "catalog/compatibility-evidence/claude/consume-infinitas-skill/0.1.1.json",
          "note": "Installed the immutable release into an isolated Claude target and validated its installable Skill layout.",
          "contract_last_verified": "2026-07-21",
          "fresh_until": "2026-08-20T14:10:22Z",
          "freshness_state": "fresh",
          "freshness_reason": "not-applicable"
        },
        "codex": {
          "state": "adapted",
          "checked_at": "2026-07-21T14:10:22Z",
          "checker": "infinitas install by-name --target-agent codex --mode auto",
          "evidence_path": "catalog/compatibility-evidence/codex/consume-infinitas-skill/0.1.1.json",
          "note": "Installed the immutable release into an isolated Codex target and validated its installable Skill layout.",
          "contract_last_verified": "2026-07-21",
          "fresh_until": "2026-08-20T14:10:22Z",
          "freshness_state": "fresh",
          "freshness_reason": "not-applicable"
        },
        "openclaw": {
          "state": "adapted",
          "checked_at": "2026-07-21T14:10:22Z",
          "checker": "infinitas openclaw skill export --mode confirm",
          "evidence_path": "catalog/compatibility-evidence/openclaw/consume-infinitas-skill/0.1.1.json",
          "note": "Exported from the immutable release artifact and passed current OpenClaw public-ready validation.",
          "contract_last_verified": "2026-07-21",
          "fresh_until": "2026-08-20T14:10:22Z",
          "freshness_state": "fresh",
          "freshness_reason": "not-applicable"
        }
      },
      "attestation_formats": [
        "ssh"
      ],
      "use_when": [
        "Need to find the best released skill for a task",
        "Need to inspect, pull, install, or upgrade a stable released skill"
      ],
      "avoid_when": [
        "Need to create a new release from source",
        "Need to debug registry federation or mirror policy"
      ],
      "runtime_assumptions": [
        "Generated catalog indexes are present or can be rebuilt",
        "Target runtime directories such as ~/.openclaw/skills are writable when installation is requested"
      ]
    },
    {
      "name": "federation-registry-ops",
      "kind": "skill",
      "qualified_name": "lvxiaoer/federation-registry-ops",
      "publisher": "lvxiaoer",
      "summary": "Help agents inspect registry sources, federation rules, mirror behavior, and audit or inventory exports inside infinitas-skill.",
      "source_registry": "self",
      "source_priority": 100,
      "match_names": [
        "federation-registry-ops",
        "lvxiaoer/federation-registry-ops"
      ],
      "default_install_version": "0.1.1",
      "latest_version": "0.1.1",
      "available_versions": [
        "0.1.1",
        "0.1.0"
      ],
      "versions": {
        "0.1.1": {
          "manifest_path": "catalog/distributions/lvxiaoer/federation-registry-ops/0.1.1/manifest.json",
          "distribution_manifest_path": "catalog/distributions/lvxiaoer/federation-registry-ops/0.1.1/manifest.json",
          "bundle_path": "catalog/distributions/lvxiaoer/federation-registry-ops/0.1.1/skill.tar.gz",
          "bundle_sha256": "088a171cf35d8711ce013a96258607fca7dbd587677bc0c476425a8a73fcab3e",
          "attestation_path": "catalog/provenance/federation-registry-ops-0.1.1.json",
          "attestation_signature_path": "catalog/provenance/federation-registry-ops-0.1.1.json.ssig",
          "published_at": "2026-07-21T13:21:05Z",
          "stability": "stable",
          "installable": true,
          "attestation_formats": [
            "ssh"
          ],
          "trust_state": "verified",
          "resolution": {
            "preferred_source": "distribution-manifest",
            "fallback_allowed": false
          }
        },
        "0.1.0": {
          "manifest_path": "catalog/distributions/lvxiaoer/federation-registry-ops/0.1.0/manifest.json",
          "distribution_manifest_path": "catalog/distributions/lvxiaoer/federation-registry-ops/0.1.0/manifest.json",
          "bundle_path": "catalog/distributions/lvxiaoer/federation-registry-ops/0.1.0/skill.tar.gz",
          "bundle_sha256": "2784d72ed2354558859f98fb695d62d33b6574d8a92aff73327c4fa52c7ab29d",
          "attestation_path": "catalog/provenance/federation-registry-ops-0.1.0.json",